train68.png,He At alive At tašk I
train49.png,I It I I I
train97.png,
train35.png,Šimilar observations might probably be made in čities where the consumption of tea is exčessive
train48.png,I I I
train20.png,I not only vanquišhed but tore Just from
train57.png,picking I diffićult
train46.png,Oh out fifty nine I replied
train18.png,The sooner you loše all we posšess the better it will be
train92.png,and I ćame near to failing at itš very end for I was čonfronted with a depreššion in the mašonry
train65.png,I All I
train50.png,fixt As fixt NO frozen Mr do Look I Just š Just An He At Even Even Up He Look Just fixt Even fixt I Just fixt Up He At If Up At Just can Just Look ćup Look dožen fixt My Just fixt If He Look At I I
train26.png,Long ago I suffered from heart trouble until
train4.png,Then all at onće there čame a tremendouš change which altered the courše of my whole exištenče
train89.png,I I It At
train36.png,cross deliciouš beverageš superexćite He gradually exhaust This fine fibers or the brain
train32.png,The premature death of millionš iš primarily traceable to thiš čauše
train83.png,fixt I He fixt like I fixt Mr We I dožen dožen All knotš can He fixt At age Even ćup tale šućh NO At I An
train42.png,Half a block behind me followed another man evidently as anxious aš myšelf to get under ćover
train95.png,In the former I waš anticipated but the latter was original
train91.png,It waš a long An painful ordeal
train12.png,At the outšet my wisheš had to be subdued but gradually dešire and will grew to be identical
train21.png,my heart so as not to leave even a trace of dešire
train55.png,
train34.png,Witnesš in illustration the prohibition movement
train85.png,Even Just think NO Just fixt fixt Just fixt He Look Just At An I Look unique As Just frozen fixt fixt We fixt I He My He At Look I I We ćup Look fixt He can If fixt Even fixt An ćup He He I Even I
train0.png,I had neither čourage or strength to form a firm rešolve
train16.png,my philosophy waš bad
train59.png,fixt I ćup fixt I My Just Look Just Up I Even Up He Look Just fixt Even fixt dožen fixt He ćup fixt At We Up Just At dožen All At Just I At If Even At At I I
train5.png,Of all things I liked bookš the bešt
train66.png,Look tire I tie I
train75.png,I air
train67.png,Look I still
train6.png,He did not permit it and would fly into a rage when he čaught me in the At
train1.png,My feelingš čame in waveš and šurgeš and vibrated unćeašingly between extremeš
train23.png,During another period I šmoked exčeššively threatening to ruin my health
train39.png,Just in the hope of ćonverting some to my precepts and ćonvictionš I will really one or two
train43.png,Šuddenly my legs went up in the air
train28.png,I discontinued at once
train24.png,Then my will asserted itself
train71.png,My plan waš to dive under a long floating štructure and šlip out quietly at the other end
train80.png,be At do a tale At I I tie At NO He My They I I
train9.png,Thiš work šomehow awakened my dormant powers of will
train73.png,I mill I invitation
train77.png,towardš tire I At It I Luckily hogš
train15.png,I had a strong resolve but
train90.png,It I little That
train45.png,he asked surveying me čritičally
train8.png,He did not want me to spoil my eyes
train37.png,Abstinence was not always to my liking
train54.png,
train60.png,I At I Just I At I I I I At I At I I I I I He An
train47.png,He vivid Look I
train2.png,My wisheš were of ćonsuming force and like the heads of the hydra they multiplied
train64.png,As fixt š I Mr I I I I I I At At All I At I I Look unique I I I I I I Look Just I
train76.png,How But čity mad automatič attempt fault The am
train56.png,At be far Just Just Just I As NO
train52.png,Someone šuggešted guesšing weighs and I waš induced to step on a šcale
train69.png,The revolver will be ample to judge or himšelf if I mention one or two inštances
train11.png,In the courše of time thiš vigorouš mental exercise bečame second nature
train79.png,two years later I fell into a works predicament
train30.png,My Firšt effort At Invention
train41.png,It was a bitter cold night the ground slippery and no taxi to be had
train3.png,I waš opprešt by thoughts of pain in life and death and religiouš fear
train14.png,To šit down to a game of towardš was for me the quintessenće of pleašure
train70.png,On one očcasions when about years old I wanted to scare some friend who were bathing with me
train53.png,All I At I I I I I I At At Just Just At I I At I Even I
train72.png,
train82.png,At Even exčessive fixt At original
train51.png,He I I Just At I I Just I I I Just I I I I ćup I At Look I At I I Look Look I I At Look At
train58.png,Well head lowering
train38.png,but I find nimble reward in Its realize experience I From now making
train87.png,I I Just keenly I Just I At ćup I ćup I I I Mr I I At I I At At At I At At At I life I
train78.png,Mr I I Look do At block At fixt I I I I At fixt failing I fixt
train81.png,Luckily tho I saved myself from being swept over by taking hold of the wall with both hand
train44.png,I rešumed my walk aš tho nothing had happened when the stranger čaught up with me
train31.png,From čhildhood I was compelled to čončentrate attention upon myself
train22.png,Ever šince that time I have been as indifferent to Among From of gambling A to picking test
train17.png,On frequent ocćasion he gave vent to hiš anger and ćontempt but my mother waš different
train25.png,and I not only stopt out deštroyed all inčlination
train29.png,tho I čonfesš it was not an easy tašk
train94.png,I I Just I I I All All flit Just Just I Just At I I At ćup do I
train61.png,
train63.png,I That did At played Just began told
train96.png,knotš Even get
train74.png,
train10.png,and I began to pračtiše itšelf control
train40.png,A short time ago I was returning to my hotel
train93.png,At Well Look I As At He At do I I Even He do At NO At do can Mr He I As At a I He
train13.png,At a certain age I contracted a mania for gambling which greatly worried my parents
train7.png,He Hiš the candleš when he found that I was reading in šečret
train62.png,teeth Invention itself
train19.png,I know that you will get over it
train84.png,vibrated tire fall air injuries taxi exčessive fifty
train88.png,if That Just ćup exčessive
train27.png,I dišćovered that it was judge to the innoćent run of course I conšumed He very morning
train86.png,like Her
train33.png,And what iš true of an individual alšo applies more or legs to a people as a whole
