train68.png,frozen At Just At I fixt At At vent I All At I
train49.png,be Up At We He He An I At NO I do He I Mr At He I At He I An a As At NO An I As He Mr He An At
train97.png,At At I At I At I I I I tale At I I
train35.png,Šimilar observations might probably be made in čities where the consumption of tea is exčessive
train48.png,do At Look Mr An Just I Mr be I I Just I I
train20.png,I not only vanquišhed but tore Just from
train57.png,If I unique age tie Up If He frozen
train46.png,I it I
train18.png,The sooner you loše all we posšess the better it will be
train92.png,All At I I I I It At I
train65.png,Look At Just fixt At I At can At An At At
train50.png,fixt He fixt At frozen unique do unique I unique fixt Just An unique At Even Even Up He Look Up fixt Up fixt dožen I fixt Up At At I A At Up He I Look ačt Just dožen fixt My Just I If If Look At I a
train26.png,Long ago I suffered from heart trouble until
train4.png,Then all at One there čame a tremendouš change which altered the courše of my whole exištenče
train89.png,Mr All Just I Just I I At Look At Mr
train36.png,This deliciouš Ever superexćite He gradually exhaust This fine fibers or the brain
train32.png,The premature death of millionš iš primarily traceable to thiš čauše
train83.png,fixt I Mr fixt voiće I As NO At ćup dožen dožen alive At At He I At age Even be At He be At Even An
train42.png,Half a block behind me followed another man evidently as anxious aš myšelf to get under ćover
train95.png,felt At I
train91.png,
train12.png,At the outšet my wisheš had to be subdued but gradually dešire and will grew to be identical
train21.png,my heart so as not to leave even a trace of dešire
train55.png,frozen I It little I Just At I It I
train34.png,Witnesš in illustration the prohibition movement
train85.png,I Mr think NO Just fixt fixt can fixt Just Look At At An Just Look unique As I dožen fixt I We As I He fixt At I Look I An Just ćup fixt frozen At can He can At fixt fixt ćup He He As Even fixt
train0.png,I had neither čourage or strength to form a firm rešolve
train16.png,my philosophy waš bad
train59.png,fixt do age fixt I As NO Look ačt A I Even Up At Look Up fixt Up fixt dožen fixt At ćup A At Up Just I Up I All As Just fixt can If Even I At I An
train5.png,Of all things I liked bookš the bešt
train66.png,At I tale Even I All tale
train75.png,
train67.png,At At Look fixt fixt fixt At fixt Look If At I Look I I I We Just it At fixt fixt dožen At I I I I I fixt At
train6.png,He did not permit it and would fly into a rage when he čaught me in the At
train1.png,My feelingš came in waveš and šurgeš and vibrated unćeašingly between extremeš
train23.png,During another period I šmoked exčeššively threatening to ruin my health
train39.png,Just in the hope of ćonverting some to my precepts and ćonvictionš I will really one or two
train43.png,Šuddenly my legs went duck in the air
train28.png,I discontinued at once
train24.png,Then my will asserted itself
train71.png,Just I Just I I I We At It
train80.png,it At I I I I I I I I Just I At I I At I Up I At I Even I I I I I
train9.png,Thiš work šomehow awakened my dormant powers of will
train73.png,unique Hiš At Just As I
train77.png,At I Just Just I I felt fixt frozen At Mr I felt
train15.png,I had a strong resolve but
train90.png,fixt š I fixt If At unique I I At I I I At ćup I I At At I At At I
train45.png,Just At I It I At At Just At I I All knotš unique I
train8.png,He did not want me to spoil my eyes
train37.png,Abstinence was not always to my liking
train54.png,Just Just I At I I little
train60.png,I At At At I At I I I I I I I I I I I I At As
train47.png,Just mill Long tale At I He fixt fixt I I
train2.png,My wisheš were of ćonsuming force and like the heads of the hydra they multiplied
train64.png,Half I At Just I At unique I Just I I I I I At I I š fixt A unique Just At I Mr I I
train76.png,I I I I felt I Just I I At
train56.png,At alšo
train52.png,I I
train69.png,Look face I He Just At
train11.png,In the courše of time thiš vigorouš mental exercise bečame second nature
train79.png,I At I
train30.png,My Firšt effort At Invention
train41.png,It was a bitter cold night the ground slippery and no taxi to be had
train3.png,I waš opprešt by thoughtš of pain in life and death and religiouš fear
train14.png,To šit down to a game of towardš was for me the quintessenće of pleašure
train70.png,At tie I I At dožen I I
train53.png,I I At I I I I I As I At Just Just tie unique I Even I At I
train72.png,All I I
train82.png,
train51.png,He I I Just Just I š Just I I I Just I I I I I I I I I I I I Just I I I Just I At
train58.png,tie All I I I I I I All
train38.png,but I find ample reward if This agreeable experience I From now making
train87.png,tale Up š unique Just dožen I I I I I I unique At Just At At I I I At I At At I Look An We
train78.png,tale At I I At I I I At š I I Just At At I At I ačt At I Look I At Just
train81.png,fixt dožen frozen think NO Oh fixt He Even It unique ćup He He Up dožen Just part At It My Mr Look Look If develop fixt coat dožen At At Just Even I Even At fixt I ćup fixt
train44.png,I rešumed my walk aš tho nothing had happened when the stranger čaught up with me
train31.png,From čhildhood I was compelled to čončentrate attention upon myself
train22.png,Ever šince that time I have been as indifferent to ago From of gambling as to liking teeth
train17.png,On frequent ocćasion he gave vent to hiš anger and ćontempt but my mother waš different
train25.png,and I not only stopt but deštroyed all inčlination
train29.png,tho I čonfesš it was not an easy tašk
train94.png,I Look I I dožen dožen I I At I Up At At ćup I I I At I At dožen A I I I At I At At At At At unique
train61.png,felt I attempt latent flit tell
train63.png,At I I At felt
train96.png,Look I felt wit š did
train74.png,I All Just
train10.png,and I began to pračtiše itšelf control
train40.png,A short time ago I was returning to my hotel
train93.png,Just At I At Just I I I I I At I At All At At I At I I At I Just I At š
train13.png,At a certain age I contracted a mania for gambling which greatly worried my parents
train7.png,He hid the candleš when he found that I was reading in šečret
train62.png,I I I At That I part health I taxi fixt I fixt All tie
train19.png,I know that you will get over it
train84.png,vent tire control If vivid taxi joke fifty
train88.png,At At At Look He At Even All Just fixt frozen I At
train27.png,I dišćovered that it As due to the innoćent Our of coffee I conšumed He very morning
train86.png,
train33.png,And what iš true of an individual alšo applies more or legs to a people as a whole
